{
  "tool_policy_id": "tool-policy-step-1b-agent",
  "schema_version": "1.0.0",
  "policy_version": "1.4.0",
  "policy_sha256": "2b2b09f58870305d54755191e7b7cd316f34b661f9897ac973c1ecabed8c5421",
  "step_id": "1b",
  "allowed_gateway_operations": [
    {
      "operation_id": "request_serp_intent_evidence",
      "tool_name": "mcp__heartweb__request_serp_intent_evidence",
      "phase": "production",
      "side_effect": "external_read",
      "provider_id": "provider-agentseo",
      "confirmation_scope": "exact_request",
      "cost_mode": "provider_credits_unreported",
      "max_calls": 2,
      "max_items": 1,
      "timeout_seconds": 600,
      "evidence_required": true,
      "input_contract_id": "heartweb.serp-intent-request.v1",
      "output_contract_id": "heartweb.serp-intent-evidence.v1"
    }
  ],
  "required_gateway_operations": [
    "request_serp_intent_evidence"
  ],
  "delegation_policy": {
    "delegation_policy_id": "delegation-policy-step-1b-v1",
    "allowed": true,
    "max_workers": 2,
    "max_depth": 1,
    "max_rounds": 1,
    "allowed_purposes": [
      "research",
      "synthesis",
      "domain_review"
    ],
    "external_side_effects_allowed": false
  },
  "direct_provider_calls_allowed": false,
  "failure_mode": "fail_closed",
  "enabled": true,
  "created_at": "2026-08-25T14:29:06Z"
}
