{
  "tool_policy_id": "tool-policy-step-1-agent",
  "schema_version": "1.0.0",
  "policy_version": "1.2.0",
  "policy_sha256": "9703f054fd023895a71b7d43b3dc57c92b077d4bbc5b72d10ca9c3ab56d45f9e",
  "step_id": "1",
  "allowed_gateway_operations": [
    {
      "operation_id": "run_screaming_frog_crawl",
      "tool_name": "mcp__heartweb__run_screaming_frog_crawl",
      "phase": "production",
      "side_effect": "external_read",
      "confirmation_scope": "step_run",
      "cost_mode": "none",
      "max_calls": 1,
      "timeout_seconds": 1200,
      "evidence_required": true,
      "input_contract_id": "heartweb.screaming-frog-request.v1",
      "output_contract_id": "heartweb.screaming-frog-evidence.v1"
    },
    {
      "operation_id": "request_serp_intent_evidence",
      "tool_name": "mcp__heartweb__request_serp_intent_evidence",
      "phase": "production",
      "side_effect": "external_read",
      "provider_id": "provider-agentseo",
      "confirmation_scope": "exact_request",
      "cost_mode": "provider_credits_unreported",
      "max_calls": 2,
      "max_items": 1,
      "timeout_seconds": 600,
      "evidence_required": true,
      "input_contract_id": "heartweb.serp-intent-request.v1",
      "output_contract_id": "heartweb.serp-intent-evidence.v1"
    }
  ],
  "required_gateway_operations": [
    "run_screaming_frog_crawl",
    "request_serp_intent_evidence"
  ],
  "delegation_policy": {
    "delegation_policy_id": "delegation-policy-step-1-v1",
    "allowed": true,
    "max_workers": 1,
    "max_depth": 1,
    "max_rounds": 1,
    "allowed_purposes": [
      "processing",
      "domain_review"
    ],
    "external_side_effects_allowed": false
  },
  "direct_provider_calls_allowed": false,
  "failure_mode": "fail_closed",
  "enabled": true,
  "created_at": "2026-08-25T20:26:02Z"
}
