{
  "tool_policy_id": "tool-policy-step-0-agent",
  "schema_version": "1.0.0",
  "policy_version": "1.2.0",
  "policy_sha256": "9056c3acdcdde6e0e85c75d159d8fd8a1cac4d5f0cde1835f6efb5198ee882e3",
  "step_id": "0",
  "allowed_gateway_operations": [
    {
      "operation_id": "prepare_kickoff_preflight",
      "tool_name": "mcp__heartweb__prepare_kickoff_preflight",
      "phase": "preflight",
      "side_effect": "read_only",
      "confirmation_scope": "none",
      "cost_mode": "none",
      "max_calls": 1,
      "timeout_seconds": 120,
      "evidence_required": true,
      "input_contract_id": "heartweb.kickoff-preflight-request.v1",
      "output_contract_id": "heartweb.kickoff-preflight-evidence.v1"
    }
  ],
  "required_gateway_operations": [
    "prepare_kickoff_preflight"
  ],
  "delegation_policy": {
    "delegation_policy_id": "delegation-policy-step-0-v1",
    "allowed": false,
    "max_workers": 0,
    "max_depth": 0,
    "max_rounds": 0,
    "allowed_purposes": [],
    "external_side_effects_allowed": false
  },
  "direct_provider_calls_allowed": false,
  "failure_mode": "fail_closed",
  "enabled": true,
  "created_at": "2026-08-24T23:39:00Z"
}
