{
  "tool_policy_id": "tool-policy-step-4b-agent",
  "schema_version": "1.0.0",
  "policy_version": "1.2.0",
  "policy_sha256": "351b305c9e62a9f7f225b6731e5cc4e289ccc55aee0e967d0bd1294f5df9fd00",
  "step_id": "4b",
  "allowed_gateway_operations": [
    {
      "operation_id": "validate_jsonld",
      "tool_name": "mcp__heartweb__validate_jsonld",
      "phase": "validation",
      "side_effect": "local_evidence_write",
      "confirmation_scope": "none",
      "cost_mode": "none",
      "max_calls": 3,
      "timeout_seconds": 60,
      "evidence_required": true,
      "input_contract_id": "heartweb.jsonld-validation-request.v1",
      "output_contract_id": "heartweb.jsonld-validation-evidence.v1"
    },
    {
      "operation_id": "run_staging_validation",
      "tool_name": "mcp__heartweb__run_staging_validation",
      "phase": "validation",
      "side_effect": "local_evidence_write",
      "confirmation_scope": "none",
      "cost_mode": "none",
      "max_calls": 1,
      "timeout_seconds": 120,
      "evidence_required": true,
      "input_contract_id": "heartweb.local-staging-readiness-request.v1",
      "output_contract_id": "heartweb.local-staging-readiness-evidence.v1"
    }
  ],
  "required_gateway_operations": [
    "validate_jsonld",
    "run_staging_validation"
  ],
  "delegation_policy": {
    "delegation_policy_id": "delegation-policy-step-4b-v1",
    "allowed": true,
    "max_workers": 2,
    "max_depth": 1,
    "max_rounds": 1,
    "allowed_purposes": [
      "processing",
      "domain_review"
    ],
    "external_side_effects_allowed": false
  },
  "direct_provider_calls_allowed": false,
  "failure_mode": "fail_closed",
  "enabled": true,
  "created_at": "2026-08-25T21:14:06Z"
}
